[
  {
    "publication_id": "cite-syed-parvez-klemens-vierlinger-albert-kriegner-khulan-se",
    "citation": "Syed, Parvez, Klemens Vierlinger, Albert Kriegner, Khulan Sergelen, Johana A. Luna-Coronell, Christine Rappaport-Fürhauser, Christa Nöhammer, Christian F. Singer and Andreas Weinhäusel. “Evaluation of auto-antibody serum biomarkers for breast cancer screening and in silico analysis of sero-reactive proteins.” (2012).",
    "doi": null,
    "pubmed_link": null,
    "publisher_link": "http://www.jmolbiochem.com/index.php/JmolBiochem/article/download/53/25"
  },
  {
    "publication_id": "doi-10-1002-1878-0261-13371",
    "citation": "Yang, Qian, et al. “Human Proteome Microarray Identifies Autoantibodies to Tumor-Associated Antigens as Serological Biomarkers for the Diagnosis of Hepatocellular Carcinoma.” Molecular Oncology, vol. 17, no. 5, May 2023, pp. 887–900. PubMed, https://doi.org/10.1002/1878-0261.13371.",
    "doi": "10.1002/1878-0261.13371",
    "pubmed_link": "https://pubmed.ncbi.nlm.nih.gov/36587394/",
    "publisher_link": "https://febs.onlinelibrary.wiley.com/doi/10.1002/1878-0261.13371"
  },
  {
    "publication_id": "doi-10-1002-ana-26943",
    "citation": "Gilligan, Michael, et al. “Paraneoplastic Calmodulin Kinase‐Like Vesicle‐Associated Protein ( CAMKV ) Autoimmune Encephalitis.” Annals of Neurology, vol. 96, no. 1, July 2024, pp. 21–33. DOI.org (Crossref), https://doi.org/10.1002/ana.26943.",
    "doi": "10.1002/ana.26943",
    "pubmed_link": "https://pubmed.ncbi.nlm.nih.gov/38634529/",
    "publisher_link": "onlinelibrary.wiley.com/doi/10.1002/ana.26943"
  },
  {
    "publication_id": "doi-10-1002-art-21269",
    "citation": "Hueber, Wolfgang, et al. “Antigen Microarray Profiling of Autoantibodies in Rheumatoid Arthritis.” Arthritis & Rheumatism, vol. 52, no. 9, Sept. 2005, pp. 2645–55. DOI.org (Crossref), https://doi.org/10.1002/art.21269.",
    "doi": "10.1002/art.21269",
    "pubmed_link": "https://pubmed.ncbi.nlm.nih.gov/16142722/",
    "publisher_link": "https://onlinelibrary.wiley.com/doi/epdf/10.1002/art.21269"
  },
  {
    "publication_id": "doi-10-1002-cncr-35158",
    "citation": "Dai, Liyuan, et al. “Identification of Novel Prognostic Autoantibodies in Diffuse Large B-Cell Lymphoma Treated with Rituximab plus Cyclophosphamide, Doxorubicin, Vincristine, and Prednisone via a High-Throughput Antigen Microarray.” Cancer, vol. 130, no. 8, Apr. 2024, pp. 1257–69. PubMed, https://doi.org/10.1002/cncr.35158.",
    "doi": "10.1002/cncr.35158",
    "pubmed_link": "https://pubmed.ncbi.nlm.nih.gov/38133926/",
    "publisher_link": "acsjournals.onlinelibrary.wiley.com/doi/10.1002/cncr.35158"
  },
  {
    "publication_id": "doi-10-1002-ijc-34334",
    "citation": "Zhuang, Liping, et al. “Circulating Tumor‐associated Autoantibodies as Novel Diagnostic Biomarkers in Pancreatic Adenocarcinoma.” International Journal of Cancer, vol. 152, no. 5, Mar. 2023, pp. 1013–24. DOI.org (Crossref), https://doi.org/10.1002/ijc.34334.",
    "doi": "10.1002/ijc.34334",
    "pubmed_link": "https://pubmed.ncbi.nlm.nih.gov/36274627/",
    "publisher_link": "https://onlinelibrary.wiley.com/doi/10.1002/ijc.34334"
  },
  {
    "publication_id": "doi-10-1002-jcb-27497",
    "citation": "Wang, Peng, et al. “Using a Panel of Multiple Tumor-Associated Antigens to Enhance the Autoantibody Detection in the Immunodiagnosis of Ovarian Cancer.” Journal of Cellular Biochemistry, vol. 120, no. 3, Mar. 2019, pp. 3091–100. PubMed, https://doi.org/10.1002/jcb.27497.",
    "doi": "10.1002/jcb.27497",
    "pubmed_link": "https://pubmed.ncbi.nlm.nih.gov/30484895/",
    "publisher_link": "https://onlinelibrary.wiley.com/doi/10.1002/jcb.27497"
  },
  {
    "publication_id": "doi-10-1002-mco2-679",
    "citation": "Liu, Xu, et al. “An Autoantibody Profile Identified by Human Genome-Wide Protein Arrays in Rheumatoid Arthritis.” MedComm, vol. 5, no. 8, Aug. 2024, p. e679. PubMed, https://doi.org/10.1002/mco2.679.",
    "doi": "10.1002/mco2.679",
    "pubmed_link": "https://pubmed.ncbi.nlm.nih.gov/39132510/",
    "publisher_link": "https://onlinelibrary.wiley.com/doi/10.1002/mco2.679"
  },
  {
    "publication_id": "doi-10-1002-pmic-200300594",
    "citation": "Nam, Myeong J., et al. “Molecular Profiling of the Immune Response in Colon Cancer Using Protein Microarrays: Occurrence of Autoantibodies to Ubiquitin C-Terminal Hydrolase L3.” Proteomics, vol. 3, no. 11, Nov. 2003, pp. 2108–15. PubMed, https://doi.org/10.1002/pmic.200300594.",
    "doi": "10.1002/pmic.200300594",
    "pubmed_link": "https://pubmed.ncbi.nlm.nih.gov/14595809/",
    "publisher_link": "https://www.scopus.com/record/display.uri?eid=2-s2.0-0242608349&origin=inward&txGid=58ccdaac1e149035d5b985d5476d33ee"
  },
  {
    "publication_id": "doi-10-1002-prca-201500096",
    "citation": "Katchman, Benjamin A., et al. “Proteomic Mapping of P53 Immunogenicity in Pancreatic, Ovarian, and Breast Cancers.” PROTEOMICS – Clinical Applications, vol. 10, no. 7, July 2016, pp. 720–31. DOI.org (Crossref), https://doi.org/10.1002/prca.201500096.",
    "doi": "10.1002/prca.201500096",
    "pubmed_link": "https://pubmed.ncbi.nlm.nih.gov/27121307/",
    "publisher_link": "https://onlinelibrary.wiley.com/doi/10.1002/prca.201500096"
  },
  {
    "publication_id": "doi-10-1002-prca-202100111",
    "citation": "Banerjee, Arghya, et al. “Evaluation of Autoantibody Signatures in Pituitary Adenoma Patients Using Human Proteome Arrays.” PROTEOMICS – Clinical Applications, vol. 16, no. 6, Nov. 2022, p. 2100111. DOI.org (Crossref), https://doi.org/10.1002/prca.202100111.",
    "doi": "10.1002/prca.202100111",
    "pubmed_link": "https://pubmed.ncbi.nlm.nih.gov/35939377/",
    "publisher_link": "https://onlinelibrary.wiley.com/doi/10.1002/prca.202100111"
  },
  {
    "publication_id": "doi-10-1002-prca-202200062",
    "citation": "Barpanda, Abhilash, et al. “A Protein Microarray‐based Serum Proteomic Investigation Reveals Distinct Autoantibody Signature in Colorectal Cancer.” PROTEOMICS – Clinical Applications, vol. 17, no. 2, Mar. 2023, p. 2200062. DOI.org (Crossref), https://doi.org/10.1002/prca.202200062.",
    "doi": "10.1002/prca.202200062",
    "pubmed_link": "https://pubmed.ncbi.nlm.nih.gov/36408811/",
    "publisher_link": "https://onlinelibrary.wiley.com/doi/10.1002/prca.202200062"
  },
  {
    "publication_id": "doi-10-1007-s00262-022-03242-0",
    "citation": "Lou, Ning, et al. “Identification of Novel Serological Autoantibodies in Chinese Prostate Cancer Patients Using High-Throughput Protein Arrays.” Cancer Immunology, Immunotherapy: CII, vol. 72, no. 1, Jan. 2023, pp. 235–47. PubMed, https://doi.org/10.1007/s00262-022-03242-0.",
    "doi": "10.1007/s00262-022-03242-0",
    "pubmed_link": "https://pubmed.ncbi.nlm.nih.gov/35831618/",
    "publisher_link": "https://link.springer.com/article/10.1007/s00262-022-03242-0"
  },
  {
    "publication_id": "doi-10-1007-s00432-023-04643-z",
    "citation": "Yao, Ning, et al. “Discovery of Potential Biomarkers for Lung Cancer Classification Based on Human Proteome Microarrays Using Stochastic Gradient Boosting Approach.” Journal of Cancer Research and Clinical Oncology, vol. 149, no. 10, Aug. 2023, pp. 6803–12. PubMed, https://doi.org/10.1007/s00432-023-04643-z.",
    "doi": "10.1007/s00432-023-04643-z",
    "pubmed_link": "https://pubmed.ncbi.nlm.nih.gov/36807761/",
    "publisher_link": "https://link.springer.com/article/10.1007/s00432-023-04643-z\nhttps://www.mcponline.org/article/S1535-9476(20)32306-9"
  },
  {
    "publication_id": "doi-10-1007-s10875-020-00937-w",
    "citation": "You, Hongqin, et al. “Serum Sp17 Autoantibody Serves as a Potential Specific Biomarker in Patients with SAPHO Syndrome.” Journal of Clinical Immunology, vol. 41, no. 3, Apr. 2021, pp. 565–75. PubMed, https://doi.org/10.1007/s10875-020-00937-w.",
    "doi": "10.1007/s10875-020-00937-w",
    "pubmed_link": "https://pubmed.ncbi.nlm.nih.gov/33392854/",
    "publisher_link": "https://link.springer.com/article/10.1007/s10875-020-00937-w"
  },
  {
    "publication_id": "doi-10-1016-j-autrev-2014-08-039",
    "citation": "Gallardo, Eduard, et al. “Cortactin Autoantibodies in Myasthenia Gravis.” Autoimmunity Reviews, vol. 13, no. 10, Oct. 2014, pp. 1003–07. DOI.org (Crossref), https://doi.org/10.1016/j.autrev.2014.08.039.",
    "doi": "10.1016/j.autrev.2014.08.039",
    "pubmed_link": "https://pubmed.ncbi.nlm.nih.gov/25193850/",
    "publisher_link": "https://linkinghub.elsevier.com/retrieve/pii/S1568-9972(14)00183-9"
  },
  {
    "publication_id": "doi-10-1016-j-bbi-2022-10-001",
    "citation": "Syu, Guan-Da, et al. “Autoantibody Profiling of Monoamine Oxidase A Knockout Mice, an Autism Spectrum Disorder Model.” Brain, Behavior, and Immunity, vol. 107, Jan. 2023, pp. 193–200. DOI.org (Crossref), https://doi.org/10.1016/j.bbi.2022.10.001.",
    "doi": "10.1016/j.bbi.2022.10.001",
    "pubmed_link": "https://pubmed.ncbi.nlm.nih.gov/36243286/",
    "publisher_link": "https://www.sciencedirect.com/science/article/pii/S0889159122004068"
  },
  {
    "publication_id": "doi-10-1016-j-canlet-2012-08-019",
    "citation": "Shan, Qiang, et al. “A Cancer/Testis Antigen Microarray to Screen Autoantibody Biomarkers of Non-Small Cell Lung Cancer.” Cancer Letters, vol. 328, no. 1, Jan. 2013, pp. 160–67. PubMed, https://doi.org/10.1016/j.canlet.2012.08.019.",
    "doi": "10.1016/j.canlet.2012.08.019",
    "pubmed_link": "https://pubmed.ncbi.nlm.nih.gov/22922091/",
    "publisher_link": "https://linkinghub.elsevier.com/retrieve/pii/S0304-3835(12)00507-1"
  },
  {
    "publication_id": "doi-10-1016-j-cca-2023-117727",
    "citation": "Zhang, Jin, et al. “Proteome Microarray Identifies Autoantibody Biomarkers for Diagnosis of Hepatitis B-Related Hepatocellular Carcinoma.” Clinica Chimica Acta; International Journal of Clinical Chemistry, vol. 554, Feb. 2024, p. 117727. PubMed, https://doi.org/10.1016/j.cca.2023.117727.",
    "doi": "10.1016/j.cca.2023.117727",